title,date,link
"Scott Pruitt, Harold Bornstein, Kanye West: Your Wednesday Briefing","Wed, 02 May 2018 10:08:28 GMT",https://www.nytimes.com/2018/05/02/briefing/scott-pruitt-harold-bornstein-kanye-west.html
New York Today: New York Today: Spring Comes to the City. For Real This Time.,"Wed, 02 May 2018 12:22:57 GMT",https://www.nytimes.com/2018/05/02/nyregion/new-york-today-spring-photos.html
California Today: California Today: Los Angeles’s New Superintendent on the Challenges Faced by Schools,"Wed, 02 May 2018 13:07:02 GMT",https://www.nytimes.com/2018/05/02/us/california-today-los-angeles-schools-superintendent.html
,,https://www.nytimes.com//
News Analysis: Why Answering Mueller’s Questions Could Be a Minefield for Trump,"Wed, 02 May 2018 07:09:31 GMT",https://www.nytimes.com/2018/05/01/us/politics/trump-mueller-interview-questions.html
"Ukraine, Seeking U.S. Missiles, Halted Cooperation With Mueller Investigation","Wed, 02 May 2018 13:25:41 GMT",https://www.nytimes.com/2018/05/02/world/europe/ukraine-mueller-manafort-missiles.html
"Justice Dept. Won’t Be Extorted, Rosenstein Warns Republicans","Tue, 01 May 2018 23:06:30 GMT",https://www.nytimes.com/2018/05/01/us/politics/rosenstein-justice-department-republicans.html
"White House Memo: ‘We’ll See,’ Trump Says on North Korea. And Iran. And Nafta. And So On.","Wed, 02 May 2018 09:00:02 GMT",https://www.nytimes.com/2018/05/02/us/politics/trump-well-see-what-happens.html
Trump’s Catchphrase: ‘We’ll See’,"Wed, 02 May 2018 08:30:04 GMT",https://www.nytimes.com/video/us/politics/100000005877823/trump-catchphrase-well-see.html
Trump’s Former Doctor Says Office Was Raided and Files Seized,"Wed, 02 May 2018 07:22:20 GMT",https://www.nytimes.com/2018/05/01/us/politics/trump-doctor-harold-bornstein.html
A Lobbyist Helped Scott Pruitt Plan a Morocco Trip. Then Morocco Hired the Lobbyist.,"Wed, 02 May 2018 02:27:54 GMT",https://www.nytimes.com/2018/05/01/us/pruitt-epa-trips-lobbyists.html
Two Top Aides to Scott Pruitt Quit the E.P.A. Unexpectedly,"Wed, 02 May 2018 02:03:57 GMT",https://www.nytimes.com/2018/05/01/climate/epa-kelly-perrotta-resignations.html
California Sues Trump Administration Over Car Emissions Rules,"Tue, 01 May 2018 23:57:52 GMT",https://www.nytimes.com/2018/05/01/climate/california-sues-trump-administration.html
Israel’s Claims on Iran Divide Europe and U.S. on Merits of Nuclear Deal,"Wed, 02 May 2018 01:21:30 GMT",https://www.nytimes.com/2018/05/01/us/politics/israel-iran-deal-united-states.html
"Global Health: Tick and Mosquito Infections Spreading Rapidly, C.D.C. Finds","Wed, 02 May 2018 00:05:38 GMT",https://www.nytimes.com/2018/05/01/health/ticks-mosquitoes-diseases.html
How to Protect Yourself From Mosquitoes and Ticks,"Wed, 02 May 2018 13:49:44 GMT",https://www.nytimes.com/2018/05/01/well/mosquitoes-ticks-lyme-disease-protection.html
What Robert Mueller Knows,"Wed, 02 May 2018 13:41:22 GMT",https://www.nytimes.com/2018/05/01/opinion/robert-mueller-russia-investigation.html
"Contributing Op-Ed Writer: To Win a Nobel, Trump Should Look to the Iran Deal","Wed, 02 May 2018 09:45:05 GMT",https://www.nytimes.com/2018/05/02/opinion/trump-north-korea-nobel-iran-nuclear-deal.html
Op-Ed Columnist: The U.S. and China Are Finally Having It Out,"Tue, 01 May 2018 22:58:28 GMT",https://www.nytimes.com/2018/05/01/opinion/america-china-trump-trade.html
Op-Ed Columnist: The Iran Deal Is a Lie,"Wed, 02 May 2018 01:03:30 GMT",https://www.nytimes.com/2018/05/01/opinion/tehran-nuclear-sanctions.html
Why Is a ‘Green’ Car Company Pivoting Back to S.U.V.s?,"Tue, 01 May 2018 23:45:12 GMT",https://www.nytimes.com/2018/05/01/opinion/ford-green-cars-suv.html
Op-Ed Columnist: The Redistribution of Sex,"Wed, 02 May 2018 09:30:04 GMT",https://www.nytimes.com/2018/05/02/opinion/incels-sex-robots-redistribution.html
Contributing Op-Ed Writer: Is America Lost in Space?,"Wed, 02 May 2018 09:45:08 GMT",https://www.nytimes.com/2018/05/02/opinion/america-lost-in-space.html
Contributing Op-Ed Writer: The Pope vs. the Populists,"Wed, 02 May 2018 09:45:04 GMT",https://www.nytimes.com/2018/05/02/opinion/catholics-poland-hungary-populists-pope-francis.html
What to Do With the ‘Bad Men’ of the #MeToo Movement,"Wed, 02 May 2018 09:49:09 GMT",https://www.nytimes.com/2018/05/02/opinion/bad-men-metoo-movement.html
"Seven States, Led by Texas, Sue to End DACA Program","Wed, 02 May 2018 00:55:38 GMT",https://www.nytimes.com/2018/05/01/us/daca-lawsuit-texas.html
Will the Fed Offer Clues About Rate Increases? Here’s What to Watch,"Wed, 02 May 2018 09:00:13 GMT",https://www.nytimes.com/2018/05/02/us/politics/federal-reserve-meeting-rates.html
Official Autopsy of Stephon Clark Questions Earlier Findings,"Wed, 02 May 2018 03:48:23 GMT",https://www.nytimes.com/2018/05/01/us/stephon-clark-official-autopsy.html
"What Is Telegram, and Why Are Iran and Russia Trying to Ban It?","Wed, 02 May 2018 12:40:04 GMT",https://www.nytimes.com/2018/05/02/world/europe/telegram-iran-russia.html
Women Said to Accuse Times Editor Who Resigned of Inappropriate Behavior,"Wed, 02 May 2018 02:24:19 GMT",https://www.nytimes.com/2018/05/01/business/times-metro-editor-accused.html
"Political Arrests, Yes. Gang Violence, No. What It Takes to Get Asylum in the U.S.","Wed, 02 May 2018 09:00:07 GMT",https://www.nytimes.com/2018/05/02/us/what-it-takes-to-get-asylum-us.html
"After Viktor Orban’s Victory, Hungary’s Judges Start to Tumble","Tue, 01 May 2018 22:50:37 GMT",https://www.nytimes.com/2018/05/01/world/europe/hungary-viktor-orban-judges.html
"Facing Budget Cuts and Teacher Shortages at Home, American School Districts Look Abroad to Hire","Wed, 02 May 2018 11:15:44 GMT",https://www.nytimes.com/2018/05/02/us/arizona-teachers-philippines.html
"Xi Tightens His Grip, and China’s Tech Giants Feel the Squeeze","Wed, 02 May 2018 09:00:07 GMT",https://www.nytimes.com/2018/05/02/technology/china-xi-technology-innovation.html
"Dear Movie Industry, We Have Thoughts","Wed, 02 May 2018 13:10:31 GMT",https://www.nytimes.com/2018/05/02/movies/dear-movie-industry-metoo-netflix.html
"Restaurant Review: French Cafe Food, Not So New but Very Much Improved","Tue, 01 May 2018 16:03:20 GMT",https://www.nytimes.com/2018/05/01/dining/la-mercerie-review-soho.html
Essay: The Russian Comic Writer Who’s an Antidote to Mad Times,"Wed, 02 May 2018 09:00:07 GMT",https://www.nytimes.com/2018/05/02/books/review/nikolai-gogol.html
"5 Shows to See in New York: ‘Me and My Girl,’ ‘Dance Nation’ and More","Tue, 01 May 2018 09:00:11 GMT",https://www.nytimes.com/2018/05/01/theater/5-recommended-shows-me-and-my-girl-dance-nation.html
How to Sell Your Old Phone Safely,"Tue, 01 May 2018 18:35:36 GMT",https://www.nytimes.com/2018/05/01/smarter-living/how-to-sell-your-phone-safely.html
The Workologist: What to Do When Your Old Boss Won’t Let Go,"Fri, 20 Apr 2018 17:43:09 GMT",https://www.nytimes.com/2018/04/20/business/new-job-old-boss.html
"Your Money Adviser: For Workers Without Retirement Savings, State-Run I.R.A.s Can Pay Off","Sat, 21 Apr 2018 03:59:59 GMT",https://www.nytimes.com/2018/04/20/your-money/state-retirement-accounts.html
"Stephen Posen Knows How to Fashion a Line. So Does His Son, Zac Posen.","Tue, 01 May 2018 16:17:27 GMT",https://www.nytimes.com/2018/05/01/arts/design/stephen-posen-zac-posen-vito-schnabel.html
"What Kanye West Said About Slavery, Mental Health and Obama in His New Interviews","Wed, 02 May 2018 01:10:11 GMT",https://www.nytimes.com/2018/05/01/arts/music/kanye-west-charlamagne-interview-tmz.html
"Abbas Attar, Who Photographed Iran’s Revolution, Dies at 74","Tue, 01 May 2018 15:09:44 GMT",https://www.nytimes.com/2018/04/30/obituaries/abbas-attar-who-photographed-irans-revolution-dies-at-74.html
Best of Late Night: Seth Meyers Says He Knows the Questions Trump Wants to Ask Mueller,"Wed, 02 May 2018 12:09:21 GMT",https://www.nytimes.com/2018/05/02/arts/television/seth-meyers-trump-robert-mueller-questions.html
Talk: Gen. Michael Hayden Has One Regret: Russia,"Tue, 01 May 2018 09:00:07 GMT",https://www.nytimes.com/2018/05/01/magazine/gen-michael-hayden-has-one-regret-russia.html
"Analysis: Sex, Sport, and Why Track and Field’s New Rules on Intersex Athletes Are Essential","Tue, 01 May 2018 00:26:02 GMT",https://www.nytimes.com/2018/04/30/sports/track-gender-rules.html
Trilobites: Humpback Whale Baby Boom Near Antarctica,"Tue, 01 May 2018 23:00:03 GMT",https://www.nytimes.com/2018/05/01/science/humpback-whale-antarctica.html
Basics: A Population That Pollutes Itself Into Extinction (and It’s Not Us),"Mon, 30 Apr 2018 15:18:15 GMT",https://www.nytimes.com/2018/04/30/science/microbes-ecological-suicide.html
Trilobites: Gaia’s Map of 1.3 Billion Stars Makes for a Milky Way in a Bottle,"Tue, 01 May 2018 17:19:22 GMT",https://www.nytimes.com/2018/05/01/science/gaia-map-milky-way.html
